SC039000_.SC,슈라이더 : 오~~~ 그 위대하신 카콘시스 교황의 친위대 장미십자회의 기사님이라고! 이런 곳에서 만나게 될 줄이야.,,Sue Ryder: Oh ~~~ that the great Pope who kakon system gisanim the SS Rose Cross meeting! I never thought I'd be seeing at this place.,Sue Ryder: Oh ~~~ that the great Pope who kakon system gisanim the SS Rose Cross meeting! I never thought I'd be seeing at this place.
SC039000_.SC,아렌트 : 다른 말은 필요없다. 나의 아버지 란포드경에 대해서만 알고 싶다.,,Arendt: The other end is not necessary. My father wants to know only ranpo Sir Roland.,Arendt: The other end is not necessary. My father wants to know only ranpo Sir Roland.
SC039000_.SC,슈라이더 : 오호라..... 더욱 놀라운 사실이 밝혀지는군. 네가 란포드경의  아들이란 말이지. 훗....애송이 기사. 내가 하는 말을 잘 들으라고. 이 세상에 살아 있는 놈들은 다 명예와 권력을 준다고 하면  사죽을 못쓰지.,,Sue Ryder: ohhora ..... jineungun found more surprising. Es What you ranpo de honor his son. Heh .... Grasshopper article. I listen to the words. They live in this world is not filled when the sajuk bestows honor and power.,Sue Ryder: ohhora ..... jineungun found more surprising. Es What you ranpo de honor his son. Heh .... Grasshopper article. I listen to the words. They live in this world is not filled when the sajuk bestows honor and power.
SC039000_.SC,"슈라이더 : 교황은 네게 분명히 속박의 빛으로 맹세를 받았을테고, 네놈은 그것을 아직도 영광으로 생각하고 있겠지?",,"Sue Ryder: savor the Pope received the oath clearly in the light of the bondage you, fucking dont think it is still in glory?","Sue Ryder: savor the Pope received the oath clearly in the light of the bondage you, fucking dont think it is still in glory?"
SC039000_.SC,아렌트 : .......,,Arendt: .......,Arendt: .......
SC039000_.SC,슈라이더 : 여기 죽어나자빠져 있는 영주도 네놈과 마찬가지라고. 내가 천년의 안식처의 지배자가 되었을 때 권력을 나눠준다고 했더니 여지없이 내게 빌붙더군.,,Sue Ryder: even here the lord killed myself out like that and fucking. When I said to share power deogun bilbut me when I was undoubtedly the ruler of the millennial rest.,Sue Ryder: even here the lord killed myself out like that and fucking. When I said to share power deogun bilbut me when I was undoubtedly the ruler of the millennial rest.
SC039000_.SC,슈라이더 : 내가 천년의 안식처와 이 세계를 지배하는 절대자가 되었을 때 시체산의 맨 위에 놓아줄려고 했는데 말이야.....하하하하하. 근데 일이 꼬여서 이렇게 될 줄은 몰랐지.,,Sue Ryder: I mean I'm trying to let go at the top of the mountain when the body is the absolute dominate the rest of the world and of the millennium ..... ha ha ha ha ha. But things twisted this would did not know.,Sue Ryder: I mean I'm trying to let go at the top of the mountain when the body is the absolute dominate the rest of the world and of the millennium ..... ha ha ha ha ha. But things twisted this would did not know.
SC039000_.SC,아렌트 : 네놈의 미친소리는 다 필요없다. 난 아버지 란포드경에 대한 사실을 듣고 싶다.,,Arendt: a crazy fucking does not need it. Father ranpo I want to hear the truth about Sir Roland.,Arendt: a crazy fucking does not need it. Father ranpo I want to hear the truth about Sir Roland.
SC039000_.SC,슈라이더 : 아~아~ 그렇게 서두르지 말라고. 란포드경한테는 나도 섭섭한 점이 있다고. 내가  란포드경에게 천년의 안식처로 가는 방법을 알려줬는데 날 이렇게 버리고 혼자만 천년의 안식처로  들어가버리다니.,,Sue Rider: Ah ~ ah ~ not to hurry so. Sir Roland ranpo hanteneun I seopseophan that point. I gave you how to go to the home of the millennium ranpo Sir Roland attend throw me away so alone into a haven for thousands of years.,Sue Rider: Ah ~ ah ~ not to hurry so. Sir Roland ranpo hanteneun I seopseophan that point. I gave you how to go to the home of the millennium ranpo Sir Roland attend throw me away so alone into a haven for thousands of years.
SC039000_.SC,슈라이더 : 생각해 보라고. 내가 얼마나 화가 나겠는지.,,Sue Ryder: Think of. I know how angry naget.,Sue Ryder: Think of. I know how angry naget.
SC039000_.SC,아렌트 : 아버지가 천년의 안식처로 들어갔다고?,,Arendt: Father deuleogatdago a haven for thousands of years?,Arendt: Father deuleogatdago a haven for thousands of years?
SC039000_.SC,슈라이더 : 이미 들어갔다.,,Sue Ryder: already entered.,Sue Ryder: already entered.
SC039000_.SC,아렌트 : 네가 어떻게 알지?,,Arendt: How do you know?,Arendt: How do you know?
SC039000_.SC,슈라이더 : 그것이 내가 짠 각본이니까.....,,Sue Ryder: It's because I worked Screenplay .....,Sue Ryder: It's because I worked Screenplay .....
SC039000_.SC,아렌트 : 각본이라고? 아버지가 지옥으로 들어가는 것이 너의 각본이라고???,,Arendt: that the screenplay? That my dad is going to hell as your script ???,Arendt: that the screenplay? That my dad is going to hell as your script ???
SC039000_.SC,슈라이더 : 너무 그렇게 흥분하지마. 건강에 안좋으니까. 교황청에서 예언서가 도난당했지?,,Sue Ryder: Do not be too excited to do so. What is good for health. The Prophets chewed stolen from the Vatican?,Sue Ryder: Do not be too excited to do so. What is good for health. The Prophets chewed stolen from the Vatican?
SC039000_.SC,아렌트 : 그걸 네가 어떻게??,,Arendt: that you do ??,Arendt: that you do ??
SC039000_.SC,"슈라이더 : 후후,,,, 내가 심어놓은 첩자가 있지.",,"Sue Ryder: Jujuy ,,,, I am not a spy planted.","Sue Ryder: Jujuy ,,,, I am not a spy planted."
SC039000_.SC,슈라이더 : 난 10년전 교황청에서 예언서를 발견하였을 때부터 차곡차곡 천년의 안식처로 들어갈 준비를 하였단 말이야. 그 준비과정에 란포드경이라는 변수가 끼어들게 되었고.,,"Sue Ryder: I mean hayeotdan ready to go step by step from the rest of the prophets when found in the Vatican 10 years ago, thousands of years. That was preparation ranpo picked variable named Sir Roland caught on.","Sue Ryder: I mean hayeotdan ready to go step by step from the rest of the prophets when found in the Vatican 10 years ago, thousands of years. That was preparation ranpo picked variable named Sir Roland caught on."
SC039000_.SC,슈라이더 : 어떻게 보면 란포드경으로 인해 일이 더 수월하게 진행되었는지도 모르지. 내가 들어갈 곳을 미리 청소해 놓았을테니까 말이야. 결국 란포드경은 날 위해 일하는 거라고!,,Sue Ryder: I do not know even how to see things progress easier due to ranpo Sir Roland. I mean I'll put a previously clean the place go. Eventually ranpo de Lord would work for me!,Sue Ryder: I do not know even how to see things progress easier due to ranpo Sir Roland. I mean I'll put a previously clean the place go. Eventually ranpo de Lord would work for me!
SC039000_.SC,아렌트 : 네놈이 감히 아버지를 이용하다니!,,Arendt: how dare you use the fucking father!,Arendt: how dare you use the fucking father!
SC039000_.SC,"슈라이더 : 헛된 명예만 생각하는 란포드경은 자신만이 세계를 구할 수 있다는  착각에 빠져 방랑을 하더라구. 하하하하, 란포드경만 아니라 교황청도 마찬가지지. 선이라는 것을 부각시키기 위해 악을 존속시킨다는 거지.",,"Sue Ryder: Only ranpo de Lord himself to think only in vain honor is missing in the illusion that you can save the world flipped a vagabond. Ha ha ha ha ha, but only if ranpo Sir Roland versa Vatican. Am sikindaneun existence of evil in order to highlight that line.","Sue Ryder: Only ranpo de Lord himself to think only in vain honor is missing in the illusion that you can save the world flipped a vagabond. Ha ha ha ha ha, but only if ranpo Sir Roland versa Vatican. Am sikindaneun existence of evil in order to highlight that line."
SC039000_.SC,슈라이더 : 그게 교황청이 천년의 제국으로 통하는 지옥문 아케론을 지금껏 파멸시키지 않고 그대로 놔뒀던 이유지.,,Sue Ryder: That's why the Holy See put the put without ever destroy the gates of hell ahkeron leading to the Empire of the millennium intact.,Sue Ryder: That's why the Holy See put the put without ever destroy the gates of hell ahkeron leading to the Empire of the millennium intact.
SC039000_.SC,아렌트 : 아~~~아~~~~ 이게 도대체 어찌된 일인가....,,Arendt: ah ah ~~~~ ~~~ What the hell is going on this had happened ....,Arendt: ah ah ~~~~ ~~~ What the hell is going on this had happened ....
SC039000_.SC,슈라이더 : 어렵게 생각하지 말라고. 결론은 하나니깐. 예언서에서 말하는 파멸과 창조의 절대자는 내가 된다.,,Sue Ryder: not to think harder. One conclusion kicks. Absolute destruction and creation in a prophetic saying is I do.,Sue Ryder: not to think harder. One conclusion kicks. Absolute destruction and creation in a prophetic saying is I do.
SC039000_.SC,아렌트 : 웃기지 마라! 예언서를 내놔!,,Arendt: Do ridiculous! Give me a prophet!,Arendt: Do ridiculous! Give me a prophet!
SC039000_.SC,슈라이더 : 훗...네놈에게 넘겨줄 것 같으냐. 이제 난  이 예언서의 봉인을 풀고 파멸과 창조의 절대자가  된다. 기다리고 있거라. 내가 절대자가 되었을 때 너를 지옥의 끓는 용암에 녹여줄테니..흐흐흐흐흐,,Sue Ryder: Heh ... 'cause it will transfer to the fucking same. Now I loosen the seal of the Prophets is the Absolute of destruction and creation. Farewell waiting. I'll nokyeojul you in boiling lava of hell when the Absolute would bring Hehe ..,Sue Ryder: Heh ... 'cause it will transfer to the fucking same. Now I loosen the seal of the Prophets is the Absolute of destruction and creation. Farewell waiting. I'll nokyeojul you in boiling lava of hell when the Absolute would bring Hehe ..
SC039000_.SC,아렌트 : 슈라이더. 내가 너를 아버지를 대신하여 처단하겠다.,,Arendt: Sue Ryder. And I will smite thee on behalf of his father.,Arendt: Sue Ryder. And I will smite thee on behalf of his father.
Sc040000_.SC,가드1 : 너희들은 죽은목숨이다.,,Guard 1: You guys are dead.,Guard 1: You guys are dead.
Sc040000_.SC,가드2 : 마녀를 가만 놔둘순 없지. 흐흐흐.,,L do not leave alone the Witch: two guards. It would bring.,L do not leave alone the Witch: two guards. It would bring.
Sc040000_.SC,가드1 : 앗! 몬스터들이 나타났다.,,Guard 1: Aww! Monster appeared.,Guard 1: Aww! Monster appeared.
Sc040000_.SC,가드2 : 도망치자!!,,Guard 2: Gardenia away!,Guard 2: Gardenia away!
Sc040000_.SC,가드1 : 함정이다!!!!,,Guard 1: Trap !!!!,Guard 1: Trap !!!!
Sc040000_.SC,아렌트 : 그 늙은이가 어떤 정보를 줄려고 했을까?  빨리 가봐야겠군,,Arendt: Did the old man is going to give you some information? Quickly got to go.,Arendt: Did the old man is going to give you some information? Quickly got to go.
Sc040000_.SC,"쟈스민 : 도와주셔서 고마워요. 내 참, 나보고 마녀라니 이게 말이 된다고 생각해요?",,"Jasmine: Thank you for help. My true, I thought that witches spells and watching this mean?","Jasmine: Thank you for help. My true, I thought that witches spells and watching this mean?"
Sc040000_.SC,아렌트 : 칼이 많이 망가졌어. 대장간에서 칼을 수리하기 위해 마을의 대장간으로 가봐야겠어.,,Arendt: I've broken a lot of knives. I should go to the village blacksmith to repair a knife from the forge.,Arendt: I've broken a lot of knives. I should go to the village blacksmith to repair a knife from the forge.
Sc040000_.SC,쟈스민 : 하지만 난 지금 마녀누명을 쓰고 있는데.......,,Jasmine: But now I've got to write an accused witch .......,Jasmine: But now I've got to write an accused witch .......
Sc040000_.SC,아렌트 : 그건 아마도 당신이 낮에 마녀의 숲에서 딴 꽃 때문일거요. 난 마을로 돌아가야겠어.,,Arendt: That's probably because you're gonna have picked flowers in the forest witch in the daytime. I gotta get back to town.,Arendt: That's probably because you're gonna have picked flowers in the forest witch in the daytime. I gotta get back to town.
Sc040000_.SC,쟈스민 : 저도 같이 가요! 이 시간의 공동묘지엔 잠시도 있기 싫어요.,,"Jasmine: I'm going with you! The cemetery of this class, I do not like it a moment.","Jasmine: I'm going with you! The cemetery of this class, I do not like it a moment."
Sc040000_.SC,가드1 : 우~~~우~~~~~ 나 좀 도와주시오.,,Guard 1: Wu Wu ~~~ ~~~~~ me embrace a little help.,Guard 1: Wu Wu ~~~ ~~~~~ me embrace a little help.
Sc040000_.SC,아렌트 : 우리가 마녀패거리가 아니다란 것을 마을사람들에게 증명해 준다면 사람들을 불러오겠소.,,"Arendt: Oh, we'll call people jundamyeon prove to the villagers that the gang is not a witch.","Arendt: Oh, we'll call people jundamyeon prove to the villagers that the gang is not a witch."
Sc040000_.SC,가드1 : 우욱~~~~ 마녀패거리가 아니란 것을 증명하겠소.,,Guard 1: Bajo prove that exude a Eww ~~~~ witch gang.,Guard 1: Bajo prove that exude a Eww ~~~~ witch gang.
Sc040000_.SC,뤼겔마을 가는길,,Rwigel town way,Rwigel town way
SC041000_.SC,아렌트 : 이런놈들 아무리 많이 와도 상관없지.  대장장이에게 이제는 언제나 이곳에 와도 상ㅇ관없다고 말을 해줘야 하나?,,"Arendt: eopji do come, no matter how much these guys. Always to the blacksmith and now here come the o pipes and ...... no one say?","Arendt: eopji do come, no matter how much these guys. Always to the blacksmith and now here come the o pipes and ...... no one say?"
SC041000_.SC,마법사 : 윽... 하늘의 천벌이 너를 기다리고 있을 것이다.  윽.,,Wizard: Ugh ... there will be a Wrath of the sky waiting for you. Ugh.,Wizard: Ugh ... there will be a Wrath of the sky waiting for you. Ugh.
SC041000_.SC,아렌트 : 죽어버렸군.  내가 왜....,,Arendt: for you.You killed. why me....,Arendt: for you.You killed. why me....
SC041000_.SC,마법사 : 윽... 하늘의 천벌이 너를 기다리고 있을 것이다.  윽.,,Wizard: Ugh ... there will be a Wrath of the sky waiting for you. Ugh.,Wizard: Ugh ... there will be a Wrath of the sky waiting for you. Ugh.
SC041000_.SC,아렌트 : 미안하네.,,Arendt: I'm sorry.,Arendt: I'm sorry.
SC041000_.SC,아렌트 : (빨리 술집주인에게 가봐야지),,Arendt (gabwayaji quickly to the bar owner),Arendt (gabwayaji quickly to the bar owner)
SC041000_.SC,뤼겔마을 가는길,,Rwigel town way,Rwigel town way
SC041000_.SC,빨리 불씨를 가지고 대장간으로 가야지.,,Gayaji to soon have a fire burning forge.,Gayaji to soon have a fire burning forge.
SC041000_.SC,아렌트 : 당신이 마법사요?  보아하니 사이비 인것같은데.  너무 겁없이 행동했더군.  술집주인이 화가 장난이 아니던데....,,Arendt: Do you wizard? Apparently it looks like a cult. The group had acted without too scared. I heard the angry bar owner is not a joke ....,Arendt: Do you wizard? Apparently it looks like a cult. The group had acted without too scared. I heard the angry bar owner is not a joke ....
SC041000_.SC,마법사 : 뭐요 당신. 뭔데 당신이 참견인가.  하늘을 무서워할줄 안다면 나를 무서워 해야 할것이다.,,Wizards: What are you. What are you two meddle. If you know you speak for fear of heaven halgeotyida be afraid of me.,Wizards: What are you. What are you two meddle. If you know you speak for fear of heaven halgeotyida be afraid of me.
SC041000_.SC,아렌트 : 훗...  폼을 그럴싸하군.  나를 너무 미워말게나.  그냥 조용히 살것을.. 쯧쯧..,,Arendt: Heh ... hagun forma form. Do not hate me too me. Just ... I will live quietly Tsk ..,Arendt: Heh ... hagun forma form. Do not hate me too me. Just ... I will live quietly Tsk ..
SC041000_.SC,아렌트 : 당신이 마법사요?  보아하니 사이비 인것같은데 조심하라고 술집주인이 죽일려고 덤빌테니까.,,Arendt: Do you wizard? Apparently deombil'll try to kill the bar owner told Looks like a cult careful.,Arendt: Do you wizard? Apparently deombil'll try to kill the bar owner told Looks like a cult careful.
SC041000_.SC,마법사 : 뭐요 당신. 뭔데 당신이 참견인가.  하늘을 무서워할줄 안다면 나를 무서워 해야 할것이다.,,Wizards: What are you. What are you two meddle. If you know you speak for fear of heaven halgeotyida be afraid of me.,Wizards: What are you. What are you two meddle. If you know you speak for fear of heaven halgeotyida be afraid of me.
SC041000_.SC,아렌트 : 훗...  폼을 그럴싸하군.  잘 살아보게나....,,Arendt: Heh ... hagun forma form. Kook alive and well ....,Arendt: Heh ... hagun forma form. Kook alive and well ....
SC041001_.SC,제목: MT를 떠난 FEW 사람들...,,Title: FEW people left the MT ...,Title: FEW people left the MT ...
SC041001_.SC,나오는 사람들: 승제 원빈 주원 경수 용일 태년 성렬 보영 민희 세진 정은 미진 서코,,People coming: joint filing Won Bin Joowon Water yongil taenyeon seongryeol Boyoung Mindy Chung Se Jin secluded seoko,People coming: joint filing Won Bin Joowon Water yongil taenyeon seongryeol Boyoung Mindy Chung Se Jin secluded seoko
SC041001_.SC,서코: 오~ 드디어 가을이다. 나으 계절...,,"Seoko: Oh, finally a fall. Better for the season ...","Seoko: Oh, finally a fall. Better for the season ..."
SC041001_.SC,원빈: 우리 출출한데 소세지나 먹으로 갑시다.,,Won Bin: It 'Let us hungry and eat a sausage.,Won Bin: It 'Let us hungry and eat a sausage.
SC041001_.SC,용일: 근데 이렇게 외딴데 소세지가 있을까?,,Yongil: but so secluded you could have sausages?,Yongil: but so secluded you could have sausages?
SC041001_.SC,원빈: 앗! 몬스터다.,,Won Bin: Aww! The Monster.,Won Bin: Aww! The Monster.
SC041001_.SC,용일: 아니야. 김주임님이야. 김석호 주임님!,,Yongil: No. Gimjuim'm here. Gimseokho chief's!,Yongil: No. Gimjuim'm here. Gimseokho chief's!
SC041001_.SC,서코: 둘이서 어디가?,,Seoko: Where two people?,Seoko: Where two people?
SC041001_.SC,원빈&용일: 소세지 먹으러요,,Won Bin & yongil: eat sausage,Won Bin & yongil: eat sausage
SC041001_.SC,서코: 소세지?! 그게 어디있는데?,,Seoko: Sausage ?! Where is it?,Seoko: Sausage ?! Where is it?
SC041001_.SC,원빈&용일: 우리도 찾는 중이예요.,,Won Bin & yongil: We're busy looking for.,Won Bin & yongil: We're busy looking for.
SC041001_.SC,서코: 음... 좋은수가... 있다. 나를 따라오니라.,,"Seoko: A good number ... Well .... La sludge, follow me.","Seoko: A good number ... Well .... La sludge, follow me."
SC041001_.SC,승제 : 아! 난 여자 친구가 필요해...   내 핸드폰 번호가 뭐였더라??? 아~ 016-212-3781이였지...,,Joint filing Oh! I need a girlfriend ... my cell phone number was it ??? The reckons Oh ... 016-212-3781,Joint filing Oh! I need a girlfriend ... my cell phone number was it ??? The reckons Oh ... 016-212-3781
SC041001_.SC,태년 : 무신소릴 하느겨. 쓸데없는 소린 하지마라.,,Taenyeon: Offal talking about a silent God. Do not Sorín useless.,Taenyeon: Offal talking about a silent God. Do not Sorín useless.
SC041001_.SC,용일: 어이! 승제! 우리랑 같이 소세지 구하러 가자!,,Yongil: Hey! Joint filing! Come to rescue Sausage with us!,Yongil: Hey! Joint filing! Come to rescue Sausage with us!
SC041001_.SC,승제: 예...,,Joint filing: Yes ...,Joint filing: Yes ...
SC041001_.SC,서코: 오옷! 여깡패들이닷!,,Seoko: ohot! Yidat over the gang!,Seoko: ohot! Yidat over the gang!
SC041001_.SC,보영: 야! 니네 어디가냐?,,Boyoung: Hey! Where y'all 'cause?,Boyoung: Hey! Where y'all 'cause?
SC041001_.SC,원빈: 음... 저... 소세지 구하러 가는데요...,,Won Bin: Um ... I ... I'm going to rescue sausage ...,Won Bin: Um ... I ... I'm going to rescue sausage ...
SC041001_.SC,"정은: 야! 웃기는 소리말구, 솔직히 말해. 어디가냐?",,"Chung: Hey! Malgu ridiculous, tell me honestly. Where nya?","Chung: Hey! Malgu ridiculous, tell me honestly. Where nya?"
SC041001_.SC,용일: 진짠데...,,Yongil: jinjjande ...,Yongil: jinjjande ...
SC041001_.SC,민희: 이것들이!,,Mindy: I ​​am!,Mindy: I ​​am!
SC041001_.SC,"보영: 야 진정해라, 민희야",,"Boyoung: I Just calm down, I'm Mindy","Boyoung: I Just calm down, I'm Mindy"
SC041001_.SC,보영: 너네들 내 손가락 맛보고 말할래 그냥 말할래.,,Boyoung: Tell me you guys wanna taste my fingers just words.,Boyoung: Tell me you guys wanna taste my fingers just words.
SC041001_.SC,"세진&성열: 왜들 싸우는가? 사이좋게들 지내야 될것 아닌가? 자, 보라! 저기 소세지 굽는 불꽃을...",,"Se Jin & Lee Sung-Yeol: waedeul fight? Whether the jinaeya will get along? Now, look! There is a flame burning sausages ...","Se Jin & Lee Sung-Yeol: waedeul fight? Whether the jinaeya will get along? Now, look! There is a flame burning sausages ..."
SC041001_.SC,주원: 우왁! 난 소세지가 아니야.,,Joowon: woowak! I'm not a sausage.,Joowon: woowak! I'm not a sausage.
SC041001_.SC,세진&성열: 자 우리모두 손을 맞잡고 왕 소세지 먹으러 가보세.,,Se Jin & Lee Sung-Yeol: Now we all hand in hand king gabose eat sausages.,Se Jin & Lee Sung-Yeol: Now we all hand in hand king gabose eat sausages.
SC041001_.SC,전원: 오! 빨리가자.,,Power: Oh! let's hurry.,Power: Oh! let's hurry.
SC041001_.SC,나레이션: 이리하여 소세지파와 손가락파의 싸움은 행복한 결말을...,,Narration: And thus the fight sausage finger wave and wave a happy ending ...,Narration: And thus the fight sausage finger wave and wave a happy ending ...
SC041001_.SC,승제 : 저..  그게요... 긁적긁적... 난 여자 친구가 필요해요...   016-212-3781 <--- 요기로 전화 많이많이 해 주세요. 히히,,"Joint filing: Well ... that's me ... scratching, scratching ... I need a girlfriend ... 016-212-3781 <--- Please call a lot more to bite. Hi-Hi","Joint filing: Well ... that's me ... scratching, scratching ... I need a girlfriend ... 016-212-3781 <--- Please call a lot more to bite. Hi-Hi"
SC041001_.SC,"원빈 : 만약에 내가 마법사라면 무엇을 할까 고민한적이 있었어. 그런데 무엇을 할 것인지 잘 모르겠더라고, 금을 만들까, 은을만들까, 가끔 기사나 도와줄까?!",,"Won Bin: I was worried hanjeokyi What to do if If I Wizard. But deorago do not know what to do, mandeulkka gold, silver mandeulkka, occasional article or want to help ?!","Won Bin: I was worried hanjeokyi What to do if If I Wizard. But deorago do not know what to do, mandeulkka gold, silver mandeulkka, occasional article or want to help ?!"
SC041001_.SC,"원빈 : 고민은 많이 했는데 잘 모르겠더라고. 그래서 하나 결심했어! 마법사가 되려고, 그렇게 세월이 흘러 지금은 마법사가 되었는데 그때 가졌던 질문에 대해서 지금도 고민중이야 그냥 이대로가 좋아.",,"Won Bin: I was worried a lot deorago do not know. So I decided one! To become a wizard, so that through the years. There's still worried about the question then had been just like a wizard anyway.","Won Bin: I was worried a lot deorago do not know. So I decided one! To become a wizard, so that through the years. There's still worried about the question then had been just like a wizard anyway."
SC041001_.SC,원빈 : 이세상 모든것이!,,Won Bin: everything this world!,Won Bin: everything this world!
SC041001_.SC,"원빈 : 아침에 일어나서 해뜨는거 보는거 좋고, 저녁에 빨갛게 해가 저물어가는거 좋고 사람들과 이야기하는거 좋고 가끔은 사람들과 헤어지는거 좋고 다시 만나도 좋고...",,"Won Bin: mannado good're going to wake up in the morning and seeing the supernatant, good going to the sun red in the evening jeomuleo haneungeo good talk with people, sometimes good people are going to break up again, well ...","Won Bin: mannado good're going to wake up in the morning and seeing the supernatant, good going to the sun red in the evening jeomuleo haneungeo good talk with people, sometimes good people are going to break up again, well ..."
SC041001_.SC,경수 : 사랑이 뭐길래...,,Water: love mwogilrae ...,Water: love mwogilrae ...
SC041001_.SC,"용일 : 보라! 여기 자랑스럽게 서 있는 나의 자태를, 이 뚝심을, 이 늠늠한 모습을...",,"Yongil: Behold! Here the ttuksim my appearance, standing proudly, the neumneum a look ...","Yongil: Behold! Here the ttuksim my appearance, standing proudly, the neumneum a look ..."
SC041001_.SC,용일 : 여기 마을 처자들은 모두 나를 흠모할께 틀림없어.,,Yongil: This village wives and children are all I'll definitely adore me.,Yongil: This village wives and children are all I'll definitely adore me.
