SC021001_.SC,아렌트 : 나도 너의 동생 일은 유감으로 생각하기 때문에  목숨만은 살려줬다. 살아 있다는 것을 감사히 여기고 썩 꺼져라!,,"Arendt: I got life, but is alive, because I do regret your brother. Gratefully consider that living rot suck!","Arendt: I got life, but is alive, because I do regret your brother. Gratefully consider that living rot suck!"
SC021001_.SC,허킨즈 : 방심하지 말아라. 지옥끝까지라도 쫓아가서 네놈을 반드시 없앨테다.,,Her Keynes: Do not be careless. Even chased all the way to hell I'm gonna be sure to remove your ass.,Her Keynes: Do not be careless. Even chased all the way to hell I'm gonna be sure to remove your ass.
SC021001_.SC,아렌트 : .......,,Arendt: .......,Arendt: .......
SC021001_.SC,아렌트 : 야!!  죽기전에 대답해.  왜 날 죽이려 했지!!!,,Arendt: Hey! Answer me before he died. Why did you kill me!,Arendt: Hey! Answer me before he died. Why did you kill me!
SC021001_.SC,기사 : 흐흐...   제기랄!!,,Article: Hehe ... Damn!,Article: Hehe ... Damn!
SC021001_.SC,아렌트 : 지독한놈.  결국 한마디 말도없이 죽었군.,,Arendt: damn bastard. Eventually the group died without saying a word.,Arendt: damn bastard. Eventually the group died without saying a word.
SC021001_.SC,아렌트 : 왠지 느낌이 안좋은데,,Arendt: why not a good feeling,Arendt: why not a good feeling
SC021001_.SC,세니갈마을,,Senigallia galmaeul,Senigallia galmaeul
SC021001_.SC,지혜의호수 가는길,,Lake wisdom way,Lake wisdom way
SC021001_.SC,셀트의 언덕,,Hill of selteu,Hill of selteu
SC021001_.SC,중심지역,,The central region,The central region
SC021001_.SC,기사 : 네가 아렌트냐?,,Article: You're Arendt?,Article: You're Arendt?
SC021001_.SC,아렌트 : 그렇다.  넌 어떤놈이기에 남의 이름을 함부로 입에 올리느냐,,Arendt: Yes. Did you raise in your mouth a person's name carelessly because some guy,Arendt: Yes. Did you raise in your mouth a person's name carelessly because some guy
SC021001_.SC,기사 : 흐흐.  알것없다.  지옥으로가서 잘 알아보거라.,,"Article: Hehe. Do not kno. Go to hell, would you recognize well.","Article: Hehe. Do not kno. Go to hell, would you recognize well."
SC021001_.SC,허킨즈 : 이봐....한참 기다렸잖아... 내동생이 죽은 빚은 갚아야지.,,Her Keynes: Hey .... I waited a long time to pay off debts ... not my brother died.,Her Keynes: Hey .... I waited a long time to pay off debts ... not my brother died.
SC021001_.SC,아렌트 : 난 너와 한가하게 싸울 시간이 없다.,,Arendt: I do not have time to fight you and leisurely.,Arendt: I do not have time to fight you and leisurely.
SC021001_.SC,허킨즈 : 내동생은 너 때문에 죽었다고!,,Her Keynes: My brother died because of you!,Her Keynes: My brother died because of you!
SC021001_.SC,허킨즈 : 이봐....한참 기다렸잖아... 내동생이 죽은 빚은 갚아야지.,,Her Keynes: Hey .... I waited a long time to pay off debts ... not my brother died.,Her Keynes: Hey .... I waited a long time to pay off debts ... not my brother died.
SC021001_.SC,아렌트 : 난 너와 한가하게 싸울 시간이 없다.,,Arendt: I do not have time to fight you and leisurely.,Arendt: I do not have time to fight you and leisurely.
SC021001_.SC,허킨즈 : 내동생은 너 때문에 죽었다고!,,Her Keynes: My brother died because of you!,Her Keynes: My brother died because of you!
SC022000_.SC,사람1 : 슈라이더가 영주의 성으로 도망쳤습니다!! 슈라이더의 집 안에는 예언서인지 뭔지에 관한 문서밖에 없습니다.,,Sue Ryder smashes fled to the castle of the Prince !!: 1 person Inside the house of Styria riders not only documents relating to whether what the prophets.,Sue Ryder smashes fled to the castle of the Prince !!: 1 person Inside the house of Styria riders not only documents relating to whether what the prophets.
SC022000_.SC,사람2 : 도데체 슈라이더가 꾸미는 일이 무었입니까?,,Person 2: What 's the hell shoes two days to decorate the rider?,Person 2: What 's the hell shoes two days to decorate the rider?
SC022000_.SC,촌장집,,Mayor House,Mayor House
SC022000_.SC,영주의 성,,Castle of the Prince,Castle of the Prince
SC022000_.SC,슈라이더의 집,,Sue Ryder home,Sue Ryder home
SC022000_.SC,여관,,motel,motel
SC022000_.SC,옛성터 가는길,,Old Castle the way,Old Castle the way
SC022000_.SC,중심지역 가는길,,The way to the central area,The way to the central area
SC022000_.SC,마을사람 : 안녕하세요 기사님.  샤르덴 마을은 무슨볼일로 오셨습니까?,,From the town: Hello knight. Did Shah reuden village comes to business?,From the town: Hello knight. Did Shah reuden village comes to business?
SC022000_.SC,마을사람 : 안녕하세요 기사님.  샤르덴 마을은 무슨볼일로 오셨습니까?,,From the town: Hello knight. Did Shah reuden village comes to business?,From the town: Hello knight. Did Shah reuden village comes to business?
SC022000_.SC,마을사람 : 안녕하세요 기사님.  샤르덴 마을은 무슨볼일로 오셨습니까?,,From the town: Hello knight. Did Shah reuden village comes to business?,From the town: Hello knight. Did Shah reuden village comes to business?
SC022000_.SC,마을사람 :,,Village People:,Village People:
SC022000_.SC,마을사람 : 슈라이더가 영주의 성으로 도망쳤습니다!!  슈라이더의 집 안에는 예언서인지 뭔지에 관한 문서밖에 없습니다.,,Sue Ryder smashes fled to the castle of the Prince !!: Villagers Inside the house of Styria riders not only documents relating to whether what the prophets.,Sue Ryder smashes fled to the castle of the Prince !!: Villagers Inside the house of Styria riders not only documents relating to whether what the prophets.
SC022000_.SC,마을사람 : 알아네셨나요?,,Village People: Did you know?,Village People: Did you know?
SC022000_.SC,마을사람 : 아이고 감사합니다.  경사났네.,,Villagers: The Gee thanks. Slope're up.,Villagers: The Gee thanks. Slope're up.
SC022000_.SC,마을사람 : 도둑은 더이상 없습니다.,,Village people: thieves are not anymore.,Village people: thieves are not anymore.
SC022000_.SC,마을사람 : 이제는 평화로운 마을 입니다.,,Villagers: Now is the peaceful village of peace.,Villagers: Now is the peaceful village of peace.
SC022000_.SC,마을사람 : 이제는 평화로운 마을입니다.,,Villagers: Now is the peaceful village of peace.,Villagers: Now is the peaceful village of peace.
SC022000_.SC,마을사람 : 천사의 피리가 비싼건가?  그것만 가지고 있으면 부자가 된다던데.,,"Village People: Did the angel of flutes expensive? It's only if you have become rich, I heard.","Village People: Did the angel of flutes expensive? It's only if you have become rich, I heard."
SC022000_.SC,마을사람 : 천사의 피리가 비싼건가?  그것만 가지고 있으면 부자가 된다던데.  기사님도 그얘기 들으셨어요?,,"Village People: Did the angel of flutes expensive? It's only if you have become rich, I heard. Gisanim also Did you hear about that?","Village People: Did the angel of flutes expensive? It's only if you have become rich, I heard. Gisanim also Did you hear about that?"
SC022000_.SC,마을사람 : 천사의 피리가 비싼건가?  그것만 가지고 있으면 부자가 된다던데.  기사님도 그얘기 들으셨어요?  어떤기사가 천사의 피리를 얻었다고 하던데....,,"Village People: Did the angel of flutes expensive? It's only if you have become rich, I heard. Gisanim also Did you hear about that? I heard that some articles will give a flute Angel ....","Village People: Did the angel of flutes expensive? It's only if you have become rich, I heard. Gisanim also Did you hear about that? I heard that some articles will give a flute Angel ...."
SC022000_.SC,마을사람 : 천사의 피리가 비싼건가?  그것만 가지고 있으면 부자가 된다던데.  기사님도 그얘기 들으셨어요?,,"Village People: Did the angel of flutes expensive? It's only if you have become rich, I heard. Gisanim also Did you hear about that?","Village People: Did the angel of flutes expensive? It's only if you have become rich, I heard. Gisanim also Did you hear about that?"
SC022000_.SC,마을사람 : 뤼겔마을은 악마의 꽃때문에 난리가 아니라고 하던데....,,"Villagers: rwigel town is not a mess, because I heard the devil's flower ....","Villagers: rwigel town is not a mess, because I heard the devil's flower ...."
SC022000_.SC,마을사람 : 뤼겔마을은 악마의 꽃때문에 난리가 아니라고 하더라고요.  용병을 모집한다나.,,Villagers: rwigel town is downed and not an uproar because of evil flowers. Recruit mercenaries me.,Villagers: rwigel town is downed and not an uproar because of evil flowers. Recruit mercenaries me.
SC022000_.SC,마을사람 : 뤼겔마을에서 꽃이 안온지도 꽤 되었군.,,Villagers: Pretty flowers for him.- map anon rwigel in town.,Villagers: Pretty flowers for him.- map anon rwigel in town.
SC022000_.SC,마을사람 : 뤼겔마을에서 꽃이 안온지도 꽤 되었군.,,Villagers: Pretty flowers for him.- map anon rwigel in town.,Villagers: Pretty flowers for him.- map anon rwigel in town.
SC022000_.SC,마을사람 : 무지 심심하군.  무슨일이 일어날것 같은데....,,Villagers: hagun plain boring. I think what will happen ....,Villagers: hagun plain boring. I think what will happen ....
SC022000_.SC,마을사람 : 인라스 마을 분위기가 이상하다고 하던데....,,I heard that the town of Ras atmosphere over ...: The Village People,I heard that the town of Ras atmosphere over ...: The Village People
SC022000_.SC,마을사람 : 인라스 마을 분위기가 이상하다고 하던데....  왕궁이 있어서 괜찮은줄 알았는데 그것이 아닌가....,,Village People: Is not I heard that the town of Ras atmosphere .... at least I thought it was good in the royal palace ....,Village People: Is not I heard that the town of Ras atmosphere .... at least I thought it was good in the royal palace ....
SC022000_.SC,마을사람 : 당신이 용을잡은 기사죠.  소문이 굉장하던데요.,,Village People: Joe articles you caught the dragon. Rumor hadeondeyo awesome.,Village People: Joe articles you caught the dragon. Rumor hadeondeyo awesome.
SC022000_.SC,마을사람 : 당신이 용을 잡은 기사죠.  소문이 굉장하던데요.,,Village People: Joe articles you caught the dragon. Rumor hadeondeyo awesome.,Village People: Joe articles you caught the dragon. Rumor hadeondeyo awesome.
SC022000_.SC,마을사람 : 오늘도 지루하군.....,,Village People: today hagun boring .....,Village People: today hagun boring .....
SC022000_.SC,마을사람 : 그런데 제가 장사도 하고있는걸 아시나요?,,Villagers: But you know what I'm doing jangsado?,Villagers: But you know what I'm doing jangsado?
SC022000_.SC,,,,
SC022000_.SC,마을사람 : 여기는 세니갈이 아니고 샤르덴이라네.,,Villagers: Here CRUSH Shah reuden not go Senigallia.,Villagers: Here CRUSH Shah reuden not go Senigallia.
SC022000_.SC,마을사람 : 여기는 세니갈이 아니고 샤르덴이라네.,,Villagers: Here CRUSH Shah reuden not go Senigallia.,Villagers: Here CRUSH Shah reuden not go Senigallia.
SC022000_.SC,마을사람 : 여기는 세니갈이 아니고 샤르덴이라네.,,Villagers: Here CRUSH Shah reuden not go Senigallia.,Villagers: Here CRUSH Shah reuden not go Senigallia.
SC022000_.SC,마을사람 : 여기는 세니갈이 아니고 샤르덴이라네.,,Villagers: Here CRUSH Shah reuden not go Senigallia.,Villagers: Here CRUSH Shah reuden not go Senigallia.
SC022000_.SC,마을사람 : 도대체 무슨일이죠?,,Village People: What the hell's going on?,Village People: What the hell's going on?
SC022000_.SC,마을사람 : 알아네셨나요?,,Village People: Did you know?,Village People: Did you know?
SC022000_.SC,마을사람 : 여기는 세니갈이 아니고 샤르덴이라네.,,Villagers: Here CRUSH Shah reuden not go Senigallia.,Villagers: Here CRUSH Shah reuden not go Senigallia.
SC022000_.SC,마을사람 : 여기는 세니갈이 아니고 샤르덴이라네.,,Villagers: Here CRUSH Shah reuden not go Senigallia.,Villagers: Here CRUSH Shah reuden not go Senigallia.
SC022000_.SC,마을사람 : 시원한 물 없나 목이마른데.,,Villagers: eopna cool water to a dry throat.,Villagers: eopna cool water to a dry throat.
SC022000_.SC,마을사람 : 시원한 물 없나 목이 마른데,,Villagers: eopna cool water to thirsty,Villagers: eopna cool water to thirsty
SC022000_.SC,마을사람 : 내 어여쁜 그녀가 보이지 않아 찾아줘!!,,Villagers: Find me my pretty she is not seen!,Villagers: Find me my pretty she is not seen!
SC022000_.SC,마을사람 : 기사님.  비밀인데 당신에게만 가르쳐 줄지.  지구가 둥글데.....,,Villagers: The knight. Secret inde give only to teach you. For the earth is round .....,Villagers: The knight. Secret inde give only to teach you. For the earth is round .....
SC022000_.SC,마을사람 : 풍요의 전당이라....   이마을 아래쪽으로 나간후 쭉내려가서 위쪽으로 올라가던가....  가물가물하군요.,,Villagers: deonga called the Hall of abundance .... and then went out to the bottom yimaeul go down all the way up to the top .... I'm gamulgamul.,Villagers: deonga called the Hall of abundance .... and then went out to the bottom yimaeul go down all the way up to the top .... I'm gamulgamul.
SC022000_.SC,마을사람 : 세상에는 무기점에서 팔지않는 신기한 아이템이 많다며,,Village People: The world is strange items that do not sell in mugijeom mandamyeo,Village People: The world is strange items that do not sell in mugijeom mandamyeo
SC022000_.SC,마을사람 : 아 심심해.,,Villagers: Oh bored.,Villagers: Oh bored.
SC022000_.SC,마을사람 : 아 심심해.,,Villagers: Oh bored.,Villagers: Oh bored.
SC022000_.SC,마을사람 : 냅둬유!  왜 귀찮게 근런디야...,,Villagers: Yes naepdwo! Why bother geunreon diya ...,Villagers: Yes naepdwo! Why bother geunreon diya ...
SC022000_.SC,마을사람 : 빌어먹을 세상이야.,,Village People: It's fucking world.,Village People: It's fucking world.
SC022000_.SC,마을사람 : 냅둬유!  왜 귀찮게 근런디야...,,Villagers: Yes naepdwo! Why bother geunreon diya ...,Villagers: Yes naepdwo! Why bother geunreon diya ...
SC022000_.SC,마을사람 : 언제부턴가 마을주변에 이상한 괴물들이 들끓기 시작했어!,,Villagers: When did buteonga strange monsters begin to boil around town!,Villagers: When did buteonga strange monsters begin to boil around town!
SC022000_.SC,마을사람 : 하늘은 왜 우리에게 이런시련을 주는지.,,Village People: Why is the sky how this ordeal for us.,Village People: Why is the sky how this ordeal for us.
SC022000_.SC,마을사람 : 예수를 믿으십시요!,,Villagers: Believe in Jesus!,Villagers: Believe in Jesus!
SC022000_.SC,마을사람 : 딸꾹!  당신 뭔데 시비야!?,,Villagers: ttalkkuk! What you need fertilizing !?,Villagers: ttalkkuk! What you need fertilizing !?
SC022000_.SC,마을사람 : 어디서 많이 본 얼굴인데...,,Villagers: It 'the face so familiar ...,Villagers: It 'the face so familiar ...
SC022000_.SC,병사 : 이곳은 옛성터로 가는길입니다.  너무 낡아 언제 무너질지 몰라 이곳을 봉쇄하라는 명령을 받았습니다.,,Soldier: This is the way to the old castle. I do not know when to fall too old and was ordered to blockade here.,Soldier: This is the way to the old castle. I do not know when to fall too old and was ordered to blockade here.
SC022000_.SC,아렌트 : 잠겨있군.,,Arendt: itgun locked.,Arendt: itgun locked.
SC022000_.SC,아렌트 : 잠겨있군.,,Arendt: itgun locked.,Arendt: itgun locked.
SC022000_.SC,병사 : 이곳은 옛성터로 가는길입니다.  너무 낡아 언제 무너질지 몰라 이곳을 봉쇄하라는 명령을 받았습니다.,,Soldier: This is the way to the old castle. I do not know when to fall too old and was ordered to blockade here.,Soldier: This is the way to the old castle. I do not know when to fall too old and was ordered to blockade here.
SC022000_.SC,아렌트 : 슈라이더!!  어디에 있느냐.,,Arendt: Sue Ryder! Where is he.,Arendt: Sue Ryder! Where is he.
SC022000_.SC,아렌트 : 슈라이더!!  어디에 있느냐.,,Arendt: Sue Ryder! Where is he.,Arendt: Sue Ryder! Where is he.
SC022000_.SC,아렌트 : 슈라이더!!  어디에 있느냐.,,Arendt: Sue Ryder! Where is he.,Arendt: Sue Ryder! Where is he.
SC022000_.SC,아렌트 : 슈라이더!!  어디에 있느냐.,,Arendt: Sue Ryder! Where is he.,Arendt: Sue Ryder! Where is he.
SC022001_.SC,마을주민 1 : 이 악마같은 슈라이더를 우리가 쓰러트렸다.,,Villagers 1: We went down a bit devilish Sue Ryder.,Villagers 1: We went down a bit devilish Sue Ryder.
SC022001_.SC,마을주민 2  : 얼마나 많은 사람들이 이 악마 때문에 죽었던가!,,Villagers 2: How many people jukeotdeonga because the devil!,Villagers 2: How many people jukeotdeonga because the devil!
SC022001_.SC,"마을주민 3  : 영주도 죽고 슈라이더도 죽고, 도적떼들도 다 죽었다. 하지만 이에 무슨  의미가 있단 말인가. 더 많은 마을사람들이 죽었는데.....",,"Villagers 3: 0 shares to die shoe riders also died, also died of the bandits. But what this means is opting vivo. More villagers died .....","Villagers 3: 0 shares to die shoe riders also died, also died of the bandits. But what this means is opting vivo. More villagers died ....."
SC022001_.SC,아렌트 : 슈라이더는 건들지 말라고 내가 분명히 말했지!,,Arendt: Sue Ryder told me not to touch clear!,Arendt: Sue Ryder told me not to touch clear!
SC022001_.SC,아렌트 : 드디어 예언서가 내손안에 들어왔군.,,Arendt: Finally outset inside the Prophets my hand.,Arendt: Finally outset inside the Prophets my hand.
SC022001_.SC,트라무스의 예언서,,Prophets of Trapani Moose,Prophets of Trapani Moose
SC022001_.SC,아렌트 : 슈라이더의 보고서에 의하면 이 예언서의 봉인은 3가지 파리루수가 있어여 풀 수 있다고 했다. 3가지의 파피루스는 세니갈에 있다고 했겠다.,,Arendt: According to the report of the shoe Rider seal of the prophets were there to solve three baseman iteoyeo Paris. Three papyrus right.For that go to Senigallia.,Arendt: According to the report of the shoe Rider seal of the prophets were there to solve three baseman iteoyeo Paris. Three papyrus right.For that go to Senigallia.
SC022001_.SC,아렌트 : 아버지. 당신은 정녕 명예만을 위해 지옥의 불구덩이로 뛰어든 것입니까! 그 대답을 들으러 제가 가겠습니다.,,"Arendt Father. Are you going to just jumped Surely though pits of Hell to Glory! To hear the answer, I will go.","Arendt Father. Are you going to just jumped Surely though pits of Hell to Glory! To hear the answer, I will go."
SC022001_.SC,아렌트 : 날 건드리지 마라. 지금 상당히 기분이 안좋다고.,,Arendt: Do not touch me. Now anjotdago quite good.,Arendt: Do not touch me. Now anjotdago quite good.
SC022001_.SC,"도적1 : 흐흐흐흐흐흐, 멍청한 녀석. 우리가 고분고분 물러날 줄 알았느냐.",,"Rogue 1 would bring would bring, stupid. Have we thought bowed compliant.","Rogue 1 would bring would bring, stupid. Have we thought bowed compliant."
SC022001_.SC,도적 : 우욱...... 영주의 보호를 받고 있는 우리를 건드리다니. 영주가 네놈을 가만두지 않을 것이다.....,,Rogue: Ouch ...... ridani touch with us under the protection of the lord. Prince will not let your ass .....,Rogue: Ouch ...... ridani touch with us under the protection of the lord. Prince will not let your ass .....
SC022001_.SC,아렌트 : 영주? 훗~ 덤빌테면 다 덤벼라. 영주도 함께 박살을 내주마.,,Arendt: 0 shares? Heh ~ temyeon deombil the on.Come. 0 shares'll also within the smashed together.,Arendt: 0 shares? Heh ~ temyeon deombil the on.Come. 0 shares'll also within the smashed together.
SC022001_.SC,사람1 : 영주가 도적떼를 보호하고 있었다고?!,,Person 1: 0 shares had to protect the bandits ?!,Person 1: 0 shares had to protect the bandits ?!
SC022001_.SC,사람2 : 그렇다면 지금까지 우린 뭐였단 말인가!,,"Person 2: So far, we mean what was sweet!","Person 2: So far, we mean what was sweet!"
SC022001_.SC,사람3 : 여러분!! 우리는 더 이상 피해를 받으며 살 수 없습니다. 돼지같은 영주와 사악한 슈라이더는 욕심없이 살고 있는 우리들을 마치 벌레 다루듯이 취급하고 있습니다. 우리의 생명은 그들이  쥐었다 폈다 하고 있습니다.,,From 3: You !! We can not live a longer receives damage. Pig Prince and a wicked shoe rider us to live without greed are like worms cover as handling. Our lives are they grasped smoked.,From 3: You !! We can not live a longer receives damage. Pig Prince and a wicked shoe rider us to live without greed are like worms cover as handling. Our lives are they grasped smoked.
SC022001_.SC,사람3 : 전 지금 당장 죽는다고 해도 영주와 슈라이더를 더 이상 용서하지 못하겠습니다. 저와 뜻을 같이 하시는 분 있으시면 영주의 성으로 쳐들어 갑시다. 이렇게 벌레취급 받고 사느니 떳떳하게 싸우다 죽는 것이 낫습니다.,,"From 3: I may die right now, I'll never forgive you no longer lords and Sue Ryder. If you like me and if you have any means let us invade the castle of the lord. This worm has been better to die fighting than live as shady deal.","From 3: I may die right now, I'll never forgive you no longer lords and Sue Ryder. If you like me and if you have any means let us invade the castle of the lord. This worm has been better to die fighting than live as shady deal."
SC022001_.SC,"사람1 : 그 말이 맞소, 나도 그대와 같이 영주의 성으로 쳐들어가겠소.",,"Person 1: matso those words, I'll have invaded the castle of the Prince as you.","Person 1: matso those words, I'll have invaded the castle of the Prince as you."
SC022001_.SC,사람2 : 나도 같이 가겠소.,,Person 2: I'll go like cattle.,Person 2: I'll go like cattle.
SC022001_.SC,아렌트 : 당신들이 영주를 죽이건 말 건 상관않겠다. 하지만 슈라이더는 절대 건들지 마라. 슈라이더는 내가 알아서 처리한다.,,Arendt: I will not say it's any of you kill a permanent thing. But Sue Ryder Do not ever touch. Sue Ryder handles my own.,Arendt: I will not say it's any of you kill a permanent thing. But Sue Ryder Do not ever touch. Sue Ryder handles my own.
SC022001_.SC,촌장집,,Mayor House,Mayor House
SC022001_.SC,영주의 성,,Castle of the Prince,Castle of the Prince
SC022001_.SC,슈라이더의 집,,Sue Ryder home,Sue Ryder home
SC022001_.SC,여관,,motel,motel
SC022001_.SC,옛성터 가는길,,Old Castle the way,Old Castle the way
SC022001_.SC,중심지역 가는길,,The way to the central area,The way to the central area
SC022001_.SC,아렌트 : 슈라이더!!  어디에 있느냐.,,Arendt: Sue Ryder! Where is he.,Arendt: Sue Ryder! Where is he.
SC022001_.SC,아렌트 : 슈라이더!!  어디에 있느냐.,,Arendt: Sue Ryder! Where is he.,Arendt: Sue Ryder! Where is he.
SC022001_.SC,아렌트 : 슈라이더!!  어디에 있느냐.,,Arendt: Sue Ryder! Where is he.,Arendt: Sue Ryder! Where is he.
SC022001_.SC,아렌트 : 슈라이더!!  어디에 있느냐.,,Arendt: Sue Ryder! Where is he.,Arendt: Sue Ryder! Where is he.
SC022001_.SC,아렌트 : 슈라이더!!  어디에 있느냐.,,Arendt: Sue Ryder! Where is he.,Arendt: Sue Ryder! Where is he.
SC022002_.SC,"나오는 사람들: 수권 승구, 동현, 도현, 광석, 태경, 순자, 주은, 용진, 인태, 정애, 홍석, 원식",,"People coming: Authorized seunggu, Donghyun, dohyeon, ores, Tae Kyung, net, Ms., yongjin, intae, jeongae, hongseok, wonsik","People coming: Authorized seunggu, Donghyun, dohyeon, ores, Tae Kyung, net, Ms., yongjin, intae, jeongae, hongseok, wonsik"
SC022002_.SC,나레이션: 이 이야기는 FEW에 전해내려오는 실제로 있었던 일을 극화로 만든것입니다.,,Narration: This story will be made actually happened handed down to dramatize the FEW.,Narration: This story will be made actually happened handed down to dramatize the FEW.
SC022002_.SC,승구: (따르르릉~) 여보세요.,,Seunggu: Hello (Ling ttareureu ~).,Seunggu: Hello (Ling ttareureu ~).
SC022002_.SC,순자: 헬프미~~~ 불량스럽게 생긴 괴물들이 나를 괴롭혀~,,Net: Help ~~~ US bad-looking monsters carefully bothered me -,Net: Help ~~~ US bad-looking monsters carefully bothered me -
SC022002_.SC,승구: 잠시만 기다려~ 금방갈께...,,Seunggu: Wait - I'll wait right ...,Seunggu: Wait - I'll wait right ...
SC022002_.SC,승구: (이놈들이구나!) 에잇! 맞좀봐라!,,Seunggu (! Darn deulyiguna) Eight! Look matjom!,Seunggu (! Darn deulyiguna) Eight! Look matjom!
SC022002_.SC,태경: 넌 누군데 사람을 때리고 그래!,,Taekyung: You're beating a man Who Yeah!,Taekyung: You're beating a man Who Yeah!
SC022002_.SC,승구: 나?! 이승구다.,,Seunggu: I ?! The yiseunggu.,Seunggu: I ?! The yiseunggu.
SC022002_.SC,태경: 이승구가 누군데?!,,Taekyung: yiseunggu is Who?!,Taekyung: yiseunggu is Who?!
SC022002_.SC,승구: 순자 애인이다.,,Seunggu: a net lovers.,Seunggu: a net lovers.
SC022002_.SC,태경: 순자가 누군데?,,Taekyung: Who's net?,Taekyung: Who's net?
