SC076000_.SC,"촌장 : 오오!!! 아렌트 기사님. 마녀의 꽃을 훌륭하게 없애버렸군요. 하하하, 이렇게 기쁠  수가...... 마을의 꽃밭에 벌들이 돌아왔답니다. 약속대로 보석을 드리겠습니다.",,"Mayor: Oh! Arendt's articles. He abandoned well to get rid of the Witch flowers. Ha ha ha, they earn a flower garden ...... not so happy. I've town back. As promised, we'll bail.","Mayor: Oh! Arendt's articles. He abandoned well to get rid of the Witch flowers. Ha ha ha, they earn a flower garden ...... not so happy. I've town back. As promised, we'll bail."
SC076000_.SC,아렌트 : 마녀의 꽃....... 어떤자의 기쁨은 또 다른자의 슬픔이 되는군.,,Arendt: The Witch of flowers ....... what's doeneungun joy is another's sorrow.,Arendt: The Witch of flowers ....... what's doeneungun joy is another's sorrow.
SC076000_.SC,"촌장 : 무슨 뜻이죠? 아참, 그건 그렇고 이번 마녀의 꽃 때문에 영주님께서 아렌트을 찾으십니다.",,"Mayor: What do you mean? Oh, by the way, my lord hath He ahrenteueul find because of this witch flowers.","Mayor: What do you mean? Oh, by the way, my lord hath He ahrenteueul find because of this witch flowers."
SC076000_.SC,아렌트 : 영주님이? 어째서 날?,,Arendt: the lord? Why me?,Arendt: the lord? Why me?
SC076000_.SC,촌장 : 그건 가보면 알 것입니다.,,Mayor: That will know If you go.,Mayor: That will know If you go.
SC076000_.SC,아렌트 : 알겠소. 영주님의 성으로 가보도록 하겠소.,,Arendt: cow knows. Bajo to go to the castle of the lord.,Arendt: cow knows. Bajo to go to the castle of the lord.
SC076000_.SC,뤼겔마을,,Rwigel town,Rwigel town
SC076000_.SC,촌장 : 빨리 부탁합니다.,,"Mayor: Quickly, please.","Mayor: Quickly, please."
SC076000_.SC,촌장 : 왜 마음이 바뀌셨습니까?,,Mayor: Why did you change your mind?,Mayor: Why did you change your mind?
SC076000_.SC,아렌트 : 의뢰를 받아들인다.,,Arendt: accept a referral.,Arendt: accept a referral.
SC076000_.SC,아렌트 : 좋습니다.  누구에게 보내면 되죠,,Arendt: Good. Doejyo to whom you send,Arendt: Good. Doejyo to whom you send
SC076000_.SC,촌장 : 세니갈마을의 촌장에게 이 서신을 보내시면 됩니다.  꼭 부탁드립니다.  돈은 받는쪽에서 줄수있도록 메모를 남기겠습니다.,,"Mayor: Mayor of Senigallia to galmaeul, send this letter. Just ask. The money I'll leave a note, so give the receiving side.","Mayor: Mayor of Senigallia to galmaeul, send this letter. Just ask. The money I'll leave a note, so give the receiving side."
SC076000_.SC,아렌트 : 죄송합니다.,,Arendt: Sorry.,Arendt: Sorry.
SC076000_.SC,촌장 : 아닙니다.  다른사람을 쓰면 되죠.  돈되는 일이라면 물불을 안가리는 사람은 많으니까요.,,Mayor: No Doejyo write others. If one person covering that money is not the Cause mulbul lot.,Mayor: No Doejyo write others. If one person covering that money is not the Cause mulbul lot.
SC076000_.SC,촌장 : 이미 그일은 다른사람을 시켰습니다.,,Mayor: That thing has already brought others.,Mayor: That thing has already brought others.
SC076000_.SC,촌장 : 나는 뤼겔마을의 촌장 입니다.  기사님은 어떻게 오셨습니까?,,Mayor: I'm the mayor of the town rwigel. How did the five gisanim?,Mayor: I'm the mayor of the town rwigel. How did the five gisanim?
SC076000_.SC,아렌트 : 세니갈마을을 찾아가는 도중인데 길을 잘못 찾아온것 같습니다.,,Arendt: It 'during a visit to Senigallia galmaeul seems to come the wrong way.,Arendt: It 'during a visit to Senigallia galmaeul seems to come the wrong way.
SC076000_.SC,촌장 : 그러십니까.  마침 잘되었군요.  때마침 급한 서신을 보내야 되는데...  사례는 지불할테니 부탁해도 될까요.,,Mayor: Do so. Finish embraced well. Just as there is an urgent need to send a letter ... Can butakhaedo case I'll pay.,Mayor: Do so. Finish embraced well. Just as there is an urgent need to send a letter ... Can butakhaedo case I'll pay.
SC076000_.SC,아렌트 : 의뢰를 받아들인다.,,Arendt: accept a referral.,Arendt: accept a referral.
SC076000_.SC,아렌트 : 좋습니다.  누구에게 보내면 되죠,,Arendt: Good. Doejyo to whom you send,Arendt: Good. Doejyo to whom you send
SC076000_.SC,촌장 : 세니갈마을의 촌장에게 이 서신을 보내시면 됩니다.  꼭 부탁드립니다.  돈은 받는쪽에서 줄수있도록 메모를 남기겠습니다.,,"Mayor: Mayor of Senigallia to galmaeul, send this letter. Just ask. The money I'll leave a note, so give the receiving side.","Mayor: Mayor of Senigallia to galmaeul, send this letter. Just ask. The money I'll leave a note, so give the receiving side."
SC076000_.SC,아렌트 : 죄송합니다.,,Arendt: Sorry.,Arendt: Sorry.
SC076000_.SC,촌장 : 아닙니다.  다른사람을 쓰면 되죠.  돈되는 일이라면 물불을 안가리는 사람은 많으니까요.,,Mayor: No Doejyo write others. If one person covering that money is not the Cause mulbul lot.,Mayor: No Doejyo write others. If one person covering that money is not the Cause mulbul lot.
SC076000_.SC,촌장 : 이번만큼은 가만히 나두지 않으리....!!!!,,Mayor: I shall not leave this as much as I still .... !!!!,Mayor: I shall not leave this as much as I still .... !!!!
SC076000_.SC,촌장 : 기사님께서도 마녀의 꽃을 없애달라는 용병 광고를 보고 오셨습니까?,,"Mayor: Oh, did you go ahead and gisanim report mercenaries ad asking to get rid of the Witch flowers?","Mayor: Oh, did you go ahead and gisanim report mercenaries ad asking to get rid of the Witch flowers?"
SC076000_.SC,아렌트 : 아니오. 난 이 마을에 찾을 것이 있어서 왔소.,,Arendt: No. I've come to find in this town.,Arendt: No. I've come to find in this town.
SC076000_.SC,촌장 : 그렇습니까?..... 어쨌든 이왕 오신김에 우리마을의 고민거리를 해결해 주지 않겠습니까?  보상은 톡톡히 해드리겠습니다.,,"Mayor: What did anyway, yes ..... would not solve the worries of our village, incidentally rob here? We will reward toktokhi.","Mayor: What did anyway, yes ..... would not solve the worries of our village, incidentally rob here? We will reward toktokhi."
SC076000_.SC,아렌트 : 음.....어떤 의뢰지?,,Arendt: Um ..... what commission?,Arendt: Um ..... what commission?
SC076000_.SC,촌장 : 우리마을은 주로 화훼를 주산업으로 하고 있습니다. 마을 뒷쪽 산에 마녀의 화원이 있는데 마녀가 키우는 꽃이 향기가 너무 강해 벌들이 다 그쪽으로만 몰려 우리마을에선 꽃을 피울 수가 없게 되었습니다.,,Mayor: Our village is mainly the floriculture industry in the State. There are gardens in the back of the mountain to the village witch witch is a strong floral scent raising bees so the crowd was not only tha can blossom In our village.,Mayor: Our village is mainly the floriculture industry in the State. There are gardens in the back of the mountain to the village witch witch is a strong floral scent raising bees so the crowd was not only tha can blossom In our village.
SC076000_.SC,아렌트 : 마녀의 꽃이라......,,Arendt: as a flower of a witch ......,Arendt: as a flower of a witch ......
SC076000_.SC,촌장 : 벌들이 모이지 않아 꽃들이 다 말라 죽어가고 있습니다. 마녀의 꽃을 없애주시지 않겠습니까?,,Mayor: bees do not gather all the flowers are dying. Would you give us to get rid of the Witch of flowers?,Mayor: bees do not gather all the flowers are dying. Would you give us to get rid of the Witch of flowers?
SC076000_.SC,아렌트 : 마녀의 꽃을 없애면 어떤 보상을 해줄 것이오?,,Arendt: Oh it Eliminating the flowers of witch give any compensation?,Arendt: Oh it Eliminating the flowers of witch give any compensation?
SC076000_.SC,촌장 : 특별히 드릴것은 없고 보석을 제가 가지고 있던 보석을 하나 드리리다.,,Mayor: The special drill is one deuriri jewelry jewelry I had not.,Mayor: The special drill is one deuriri jewelry jewelry I had not.
SC076000_.SC,아렌트 : 음...... 알겠소. 마녀의 꽃을 없애주겠소.,,Arendt: Well ...... cattle right. Note'll get rid of the Witch flowers.,Arendt: Well ...... cattle right. Note'll get rid of the Witch flowers.
SC076000_.SC,촌장 : 마녀의 꽃은 마을 뒤의 숲에 있습니다. 조심하십시오. 마녀의 꽃은 향기가 강해  향기를 맡는 순간 숨이 멎어버릴지도 모릅니다.,,Mayor: flowers of witch are in the woods behind the village. Please be careful. Flowers of witch might throw breathtaking moments panic stronger the smell and they go out and smell.,Mayor: flowers of witch are in the woods behind the village. Please be careful. Flowers of witch might throw breathtaking moments panic stronger the smell and they go out and smell.
SC076000_.SC,마녀의 꽃,,Witch of flowers,Witch of flowers
SC076000_.SC,촌장 : 독한 향기에는 독한 냄새로 대처하는게 가장 현명한 방법이죠.,,Mayor: There's a strong smell wisest if we do deal with a strong odor.,Mayor: There's a strong smell wisest if we do deal with a strong odor.
SC076000_.SC,촌장 : 영주님께 빨리 가보시죠.,,Mayor: 0 shares God's gabosi quickly.,Mayor: 0 shares God's gabosi quickly.
SC076000_.SC,촌장 : 살기좋은 뤼겔마을의 촌장입니다.  한동안 푹 머물렀다가 가셔도 좋습니다.,,Mayor: The mayor of a good live rwigel town. While the remained free to leave a good sleep.,Mayor: The mayor of a good live rwigel town. While the remained free to leave a good sleep.
SC076000_.SC,쟈스민 : 영주님께 빨리 가보세요.  다음에 다시볼일이 있겠죠.,,"Jasmine: 0 shares Dear, head quickly. Guess the next cobblestone back in.","Jasmine: 0 shares Dear, head quickly. Guess the next cobblestone back in."
SC077000_.SC,인라스마을,,Village Inn Las,Village Inn Las
SC077000_.SC,베스란 : 아렌트기사 미안하네.,,Beth is: I'm sorry Arendt articles.,Beth is: I'm sorry Arendt articles.
SC077000_.SC,베스란 : 그 어린기사가 실패한 모양이군.,,Beth is: the young knight That's unsuccessful shape.,Beth is: the young knight That's unsuccessful shape.
SC077000_.SC,아렌트 : 왜!  넌 왜 나를 죽이려 하느냐?,,Arendt: Why? Why do you kill me?,Arendt: Why? Why do you kill me?
SC077000_.SC,베스란 : 장미십자회의 메런드을 기억하는가?  나의 하나밖에 없는 아들이지.,,Beth is: Does the Rose Cross Conference mereon deueul remember? Not only it is not one of my sons.,Beth is: Does the Rose Cross Conference mereon deueul remember? Not only it is not one of my sons.
SC077000_.SC,아렌트 : 그 하나밖에 없는 아들이 나를 죽이려 했던것을 알고있는가?,,Arendt: Do you know that no one outside his son was trying to kill me?,Arendt: Do you know that no one outside his son was trying to kill me?
SC077000_.SC,베스란 : 알고있다.  알면서도 말리지 못한 내자신이 비참하군.  어쩔수 없다고 하면 이해할수 있는가?  그래도 아들이었기에....,,Beth is: I know. Knowing my own who curled's miserable.Solid. I can not help it if you can understand? But yieotgie son ....,Beth is: I know. Knowing my own who curled's miserable.Solid. I can not help it if you can understand? But yieotgie son ....
SC077000_.SC,베스란 : 죽어도 아무 할말이 없네 날 죽여주게,,Beth is: give nothing to say die is eopne kill me,Beth is: give nothing to say die is eopne kill me
SC077000_.SC,베스란 : 저는 이마을의 원로 입니다.  궁금한것이 있으면 오십시요.,,Beth is: I am a veteran of yimaeul. If any questions ohsipsiyo.,Beth is: I am a veteran of yimaeul. If any questions ohsipsiyo.
SC077000_.SC,아렌트 : 망각의 성에 대해서 알고 싶소.,,Arendt: I want to know about sex in oblivion.,Arendt: I want to know about sex in oblivion.
SC077000_.SC,"베스란 : 헐헐, 요즘 들어 망각의 성을 찾는 기사들이 많군. 역시 미녀가 좋긴 좋은 모양이야.",,"Beth is: heolheol, lately mangun are looking for articles of the oblivion. It's also a great, great shape beauty.","Beth is: heolheol, lately mangun are looking for articles of the oblivion. It's also a great, great shape beauty."
SC077000_.SC,"베스란 : 제가 말이죠, 젊었을 때 이래뵈도 아주 유명한 음유시인이었답니다. 그래서 온 대륙의 이곳저곳을 안다녀 본 곳이 없죠...",,"Beth is: I know, a very famous poet, bard yieotdapnida yiraeboedo youth. So I do not go from place to place on the continent where the eopjyo ...","Beth is: I know, a very famous poet, bard yieotdapnida yiraeboedo youth. So I do not go from place to place on the continent where the eopjyo ..."
SC077000_.SC,아렌트 : .......,,Arendt: .......,Arendt: .......
SC077000_.SC,"베스란 : 망각의 성이란 곳은 말이죠, 원래는 신성롬바오르 제국시대의 어느 세력있는 영주의 성이었지만  마신을 앞세운 사도 바알에 의해 불타게 되었죠.",,"Beth is: where is the Castle of Oblivion you know, originally was the lord of the power of the Holy One Lomba ascended the imperial era, it became burned by the apostles of Baal apseun a drink.","Beth is: where is the Castle of Oblivion you know, originally was the lord of the power of the Holy One Lomba ascended the imperial era, it became burned by the apostles of Baal apseun a drink."
SC077000_.SC,"베스란 : 성의 영주도 죽고 시종들도 죽고, 모든 사람이 다 죽었습니다.  단 한 사람 영주의 딸만 빼놓고 말이죠.",,"Beth is: 0 shares castle to die die also beginning to end, we are all dead men. The only one who put malyijyo daughters out of 0 shares.","Beth is: 0 shares castle to die die also beginning to end, we are all dead men. The only one who put malyijyo daughters out of 0 shares."
SC077000_.SC,아렌트 : 영주의 딸이라고?,,Arendt: as the daughter of the prince?,Arendt: as the daughter of the prince?
SC077000_.SC,베스란 : 끝까지 들어보십시오. 사도 바알은 영주 딸의 아름다움에 한눈에 반해 그녀를 죽이지 못했던 거죠.  바알은 그녀를 독차지 하기 위해 그녀에게 잠자는 마법을 걸어놓고 다시  신성롬바오르 제국의 침략에 나섰죠.,,Beth is: listen to the end. Apostle Baal did love at first sight by the beauty of the prince did not kill her daughter. Baal place to walk to her sleeping spell to monopolize her divine Lomba's again set out to climb the invasion of Britain.,Beth is: listen to the end. Apostle Baal did love at first sight by the beauty of the prince did not kill her daughter. Baal place to walk to her sleeping spell to monopolize her divine Lomba's again set out to climb the invasion of Britain.
SC077000_.SC,베스란 : 그리고 외부인들의 침략을 막기 위해 몬스터들을 성안에 풀어놔서 미녀에게 아무도 접근하지  못하게 해 놨죠. 제가 아는 건 여기까지입니다. 젊은 기사님 당신이라면 영주의 딸을 만날수 있을 것입니다..,,Beth is: everbring and release the castle the monsters to prevent the invasion of outsiders to the beauty you laid no inaccessible. I know a thing here. If you are a young knight you will meet the daughter of the prince.,Beth is: everbring and release the castle the monsters to prevent the invasion of outsiders to the beauty you laid no inaccessible. I know a thing here. If you are a young knight you will meet the daughter of the prince.
SC077000_.SC,아렌트 : 그 망각의 성이 어디에 있는지 알수 있소?,,Arendt: itso know if the castle of oblivion Where?,Arendt: itso know if the castle of oblivion Where?
SC077000_.SC,베스란 : 음.......그게 말이죠......,,Beth is: um ....... What malyijyo ......,Beth is: um ....... What malyijyo ......
SC077000_.SC,아렌트 : ???,,Arendt: ???,Arendt: ???
SC077000_.SC,베스란 : 하도 오래 전에 들은 얘기라 잘 기억나지 않는군요.....술집에 가서 물어보시죠. 술집엔 여행자들이 많이 왕래하기 때문에 정보를 얻을 수 있을 겁니다.,,Beth is: Primer I do not remember well are born long before the talk called ..... You'd better go to the pub. Bars yen'll travelers can get information because they travel a lot.,Beth is: Primer I do not remember well are born long before the talk called ..... You'd better go to the pub. Bars yen'll travelers can get information because they travel a lot.
SC077000_.SC,슬픔의 목걸이,,Necklace of sorrow,Necklace of sorrow
SC077000_.SC,베스란 : 아렌트 기사님 아니십니까.,,Beth is: Do Arendt's article no.,Beth is: Do Arendt's article no.
SC077000_.SC,아렌트 : 아니 저를 어떻게 아시죠?,,How do you know that your not: Arendt?,How do you know that your not: Arendt?
SC077000_.SC,베스란 : 저는 이마을의 원로 입니다.  제가 아니면 누가 알겠습니까.  맡으신일 열심히 하십시요.  좋은 기회가 될테니.,,Beth is: I am a veteran of yimaeul. Or who knows me. Please take on Shinil hard. We gonna have a good chance.,Beth is: I am a veteran of yimaeul. Or who knows me. Please take on Shinil hard. We gonna have a good chance.
SC078000_.SC,,,,
SC078000_.SC,여관주인 : 좀비들로부터 절 구해줘서 고맙습니다.,,Innkeeper: Thank you for saving standing section from the zombies.,Innkeeper: Thank you for saving standing section from the zombies.
SC078000_.SC,"아렌트 : 헉, 꿈이었구나......",,"Arendt: Wow, dreams ...... yieotguna","Arendt: Wow, dreams ...... yieotguna"
SC078000_.SC,??? : 으악~~ 도와줘~~~~,,??? : Whoops ~ ~ Help ~~~~,??? : Whoops ~ ~ Help ~~~~
SC078000_.SC,아렌트 : 무슨 소리지? 밖에 나가봐야겠군.,,Arendt: What was that? You only need to see the group.,Arendt: What was that? You only need to see the group.
SC078000_.SC,아렌트 : 읔.... 좀비다! 일단 해치우고 보자!,,Arendt: Ugh .... the zombies! Once let Hugo hatch!,Arendt: Ugh .... the zombies! Once let Hugo hatch!
SC078000_.SC,,,,
SC078000_.SC,,,,
SC078000_.SC,아렌트 : 여관주인! 괜찮소?.,,Arendt: the innkeeper! Are you okay?,Arendt: the innkeeper! Are you okay?
SC078000_.SC,아렌트 : ......,,Arendt: ......,Arendt: ......
SC078000_.SC,아렌트 : 기절했군.,,Arendt: squeezes stunned.,Arendt: squeezes stunned.
SC078000_.SC,아렌트 : 대장간으로 가서 망가진 칼을 고쳐야겠군.,,Arendt: got to go to the blacksmith to mend the broken sword.,Arendt: got to go to the blacksmith to mend the broken sword.
SC078000_.SC,여관주인 : 안녕하십니까.  여기는 뤼겔마을의 여관입니다.,,Innkeeper: Good afternoon. Here is the rwigel village inn.,Innkeeper: Good afternoon. Here is the rwigel village inn.
SC078000_.SC,뤼겔마을,,Rwigel town,Rwigel town
SC078000_.SC,,,,
SC078000_.SC,여관주인 : 좀비들로부터 절 구해줘서 고맙습니다.  작은것이지만 받아주십시요.  감사의 표시입니다.,,Innkeeper: Thank you for saving standing section from the zombies. Please take a little but. A display of gratitude.,Innkeeper: Thank you for saving standing section from the zombies. Please take a little but. A display of gratitude.
SC078000_.SC,여관주인 : 기사님께 편지가 왔습니다.,,Innkeeper: God has an article write.,Innkeeper: God has an article write.
SC078000_.SC,아렌트 : 누구지?  나에게 편지를 보낼사람이 없을텐데??,,Arendt: Who are you? I would not have people send me letters ??,Arendt: Who are you? I would not have people send me letters ??
SC078000_.SC,세실의 편지 : 기사님 안녕하세요.  이 편지를 받으시면 우리마을의 원형경기장으로 오세요.  긴히 드릴말씀이...,,"Cecil letter: Hello articles. When you receive this letter, come to the arena of our village. Ginhi give the word ...","Cecil letter: Hello articles. When you receive this letter, come to the arena of our village. Ginhi give the word ..."
SC078000_.SC,아렌트 : 오호.  역시 사람보는 눈이 있는 아가씨군.  그런데 하필 원형경기장이야?  빨리 가봐야지.,,Arendt: Cor. The military also lady in the eye the beholder. But it's hapil arena? Gabwayaji quickly.,Arendt: Cor. The military also lady in the eye the beholder. But it's hapil arena? Gabwayaji quickly.
SC082000_.SC,디노의 마을,,Village of Dino,Village of Dino
SC083000_.SC,디노의 마을,,Village of Dino,Village of Dino
SC083000_.SC,금의 방,,Gold room,Gold room
SC083000_.SC,뇌의 방,,Brains room,Brains room
SC083000_.SC,목의 방,,Neck Rooms,Neck Rooms
SC084000_.SC,디노의 마을,,Village of Dino,Village of Dino
SC084000_.SC,지옥 제3의 2옥,,2 octanoic Hell 3,2 octanoic Hell 3
SC085000_.SC,지옥 제3의 1옥,,1 octanoic Hell 3,1 octanoic Hell 3
SC086000_.SC,디노의 마을,,Village of Dino,Village of Dino
SC086000_.SC,지옥 제4의 2옥,,2 octanoic Hell 4,2 octanoic Hell 4
SC086000_.SC,지옥 제4의 2옥,,2 octanoic Hell 4,2 octanoic Hell 4
SC087000_.SC,지옥 제4의 1옥,,1 octanoic Hell 4,1 octanoic Hell 4
SC087000_.SC,지옥 제4의 2옥,,2 octanoic Hell 4,2 octanoic Hell 4
SC088000_.SC,디노의 마을,,Village of Dino,Village of Dino
SC088000_.SC,지옥 제5의 2옥,,Hell second oxide of the fifth,Hell second oxide of the fifth
SC089000_.SC,지옥 제5의 1옥,,Hell one oxide of the fifth,Hell one oxide of the fifth
SC090000_.SC,디노의 마을,,Village of Dino,Village of Dino
SC091000_.SC,디노의 마을,,Village of Dino,Village of Dino
SC091000_.SC,지옥 제7의 1옥,,1 oxide in the seventh hell,1 oxide in the seventh hell
SC092000_.SC,지옥 제7의 1옥,,1 oxide in the seventh hell,1 oxide in the seventh hell
SC092000_.SC,지옥 제7의 3옥,,Ok of the seventh hell,Ok of the seventh hell
SC093000_.SC,지옥 제7의 2옥,,2 octanoic Hell seventh,2 octanoic Hell seventh
SC093000_.SC,기사2: 쯧쯧!!!!  이번에도 하나 걸렸군.,,"Article 2: Tsk !!!! Again, the group took one.","Article 2: Tsk !!!! Again, the group took one."
SC094000_.SC,디노의 마을,,Village of Dino,Village of Dino
SC094000_.SC,지옥 제8의 2옥,,2 octanoic Hell eighth,2 octanoic Hell eighth
SC094000_.SC,크림힐트 : 사자의 땅에 들어온 두 번째 산자여! 내말에 귀를 귀울여 보아요!,,Keurimhilteu: Thou came into the land of the second mountain lion! Spy girl listens to me!,Keurimhilteu: Thou came into the land of the second mountain lion! Spy girl listens to me!
SC094000_.SC,크림힐트 : 난 가장 위대했던 영웅인 지그프리트의 연인이자 역사상 가장 무서운 대왕 아틸라의 부인이었던 크림힐트라고 합니다.,,Keurimhilteu: I must say was the wife of the most feared and lovers of the great Attila hero Siegfried was the greatest of keurimhilteu.,Keurimhilteu: I must say was the wife of the most feared and lovers of the great Attila hero Siegfried was the greatest of keurimhilteu.
SC094000_.SC,크림힐트 : 나의 육신은 오랜 세월이 흘러 이렇게 추한 모습으로 변해 버렸지만 그대를 향한 나의 아름다운 마음만은 지금까지 변하지 않고 청춘의 모습을 유지하고 있어요.. ...이제 난 나의 마음을 ....,,"Keurimhilteu: My body is just beoryeotji turned to so ugly a long time to flow only toward the heart, you're my beautiful and unchanged until now maintain the look of youth ... ... and now I my mind ....","Keurimhilteu: My body is just beoryeotji turned to so ugly a long time to flow only toward the heart, you're my beautiful and unchanged until now maintain the look of youth ... ... and now I my mind ...."
SC094000_.SC,크림힐트 : 영웅을 시기하는 자들에 의해 죽어버린 나의 지크프리트! 난 그대의 복수를 위해 그대와 같이 죽음 택하지 않고 도적같은 자 하겐을 죽일 때까지 삶의 치욕을 견뎌왔지만.... 이 차가운 땅에서 너무 오랜 시간을 견디어 왔어..,,Keurimhilteu: My Siegfried abandoned by those who died when the hero! When I came to kill the thief's death does not choose the same party Hagen as you endure the humiliating revenge for thy life .... I've endured too long in the cold ground.,Keurimhilteu: My Siegfried abandoned by those who died when the hero! When I came to kill the thief's death does not choose the same party Hagen as you endure the humiliating revenge for thy life .... I've endured too long in the cold ground.
SC094000_.SC,크림힐트 : 이제 난 그대의 죽음으로 내몬 반지와 허리띠를 버리고 홀가분 해지고 싶어! 그대와의 기억은 레테의 강을 건너며 사라지겠지만 우리의 사랑은 영원하리라!,,"Keurimhilteu: Now I want to become holgabun abandon naemon rings and belts in thy death! Memories and you will disappear, but said, across the river Lethe of our love shall forever!","Keurimhilteu: Now I want to become holgabun abandon naemon rings and belts in thy death! Memories and you will disappear, but said, across the river Lethe of our love shall forever!"
SC095000_.SC,지그프리트 : 나의 사랑하는 여인! 크림힐트여! 이제 레테의 강을 건너면 그대와 나눈 우리의 사랑은 잊혀지겠지만.. 내 마음속에 숨겨져 있는 그대를 향한 마음만은 결코 잊지 않으리...,,"Siegfried: My dear lady! Open keurimhilteu! Now our love shared with you, cross the river Lethe is forgotten ... but only heart toward thee hidden in my heart I shall never forget ...","Siegfried: My dear lady! Open keurimhilteu! Now our love shared with you, cross the river Lethe is forgotten ... but only heart toward thee hidden in my heart I shall never forget ..."
SC095000_.SC,지옥 제8의 1옥,,1 octanoic Hell eighth,1 octanoic Hell eighth
